<?xml version="1.0" encoding="utf-8"?>

<!-- Umayyad forces are organized into one corps 5 regiments and two of 3 regiments each.
All units above lance/platoon size contain a mixture of Meks, vehicles, and infantry,
with a total Mek component of 1-2 battalions. FM:P does not mention aerospace support,
but a wing per corps seemed reasonable. -->

<ruleset faction="UC" parent="Periphery" ratingSystem="IS" xmlns:xsi="http://www.w3.org/2001/XMLSchema-instance" xsi:noNamespaceSchemaLocation="formationRulesetSchema.xsd">

	<defaults>
		<eschelon>%BRIGADE%</eschelon>
		<rankSystem>%RANK_CUSTOM%</rankSystem>
		<rating>C</rating>
	</defaults>
	
	<customRanks>
		<rank>%E1%:Safiya</rank>
		<rank>%LT%:Amir 'ashara</rank>
		<rank>%CAPTAIN%:Amir kabir</rank>
		<rank>%MAJOR%:Amir mi'a</rank>
		<rank>%COLONEL%:Atabeg</rank>
	</customRanks>

	<toc>
		<unitType>
			<option>null,Mek,Tank,VTOL,Infantry,AeroSpaceFighter,Conventional Fighter</option>
		</unitType>
		
		<eschelon>
			<option ifUnitType="">%BRIGADE%,%REGIMENT%,%BATTALION%,%COMPANY%</option>
			<option ifUnitType="Mek|Tank|VTOL">%LANCE%</option>
			<option ifUnitType="Infantry">%PLATOON%</option>
			<option ifUnitType="AeroSpaceFighter|Conventional Fighter">%WING%,%SQUADRON%,%FLIGHT%</option>
		</eschelon>
		
		<rating>
			<option>A,B,C,D,F</option>
		</rating>
	</toc>
	
	<force eschelon="%BRIGADE%" eschName="Corps">
		<co>%COLONEL%</co>
		
		<subforces>
			<subforceOption>
				<option num="5">%REGIMENT%</option>
				<option num="3" weight="2">%REGIMENT%</option>
			</subforceOption>
		</subforces>
		
		<attachedForces>
			<subforce unitType="AeroSpaceFighter">%WING%</subforce>
		</attachedForces>
	</force>

	<force eschelon="%REGIMENT%" eschName="Regiment" ifUnitType="">
		<co>%COLONEL%</co>
		
		<weightClass>
			<option weight="1">H</option>
			<option weight="3">M</option>
			<option weight="2">L</option>
		</weightClass>
		
		<subforces>
			<subforceOption ifWeightClass="A">
				<option weightClass="A,H,H">%BATTALION%</option>
				<option weightClass="A,H,M">%BATTALION%</option>
				<option weightClass="A,H,L">%BATTALION%</option>
				<option weightClass="A,M,M" weight="2">%BATTALION%</option>
				<option weightClass="A,M,L" weight="2">%BATTALION%</option>
			</subforceOption>
			<subforceOption ifWeightClass="H">
				<option weightClass="H,H,H">%BATTALION%</option>
				<option weightClass="H,H,M">%BATTALION%</option>
				<option weightClass="H,H,L" weight="2">%BATTALION%</option>
				<option weightClass="H,M,M" weight="3">%BATTALION%</option>
				<option weightClass="H,M,L" weight="2">%BATTALION%</option>
			</subforceOption>
			<subforceOption ifWeightClass="M">
				<option weightClass="H,M,M" weight="2">%BATTALION%</option>
				<option weightClass="H,M,L">%BATTALION%</option>
				<option weightClass="M,M,M" weight="3">%BATTALION%</option>
				<option weightClass="M,M,L" weight="2">%BATTALION%</option>
			</subforceOption>
			<subforceOption ifWeightClass="L">
				<option weightClass="H,L,L">%BATTALION%</option>
				<option weightClass="M,M,L" weight="2">%BATTALION%</option>
				<option weightClass="M,L,L" weight="3">%BATTALION%</option>
				<option weightClass="L,L,L">%BATTALION%</option>
			</subforceOption>
		</subforces>
	</force>
	
	<force eschelon="%BATTALION%" eschName="Battalion" ifUnitType="">
		<name>{ordinal} Battalion</name>
		<co>%MAJOR%</co>
		
		<weightClass>
			<option weight="1">A</option>
			<option weight="4">H</option>
			<option weight="6">M</option>
			<option weight="4">L</option>
		</weightClass>
		
		<subforces>
			<subforceOption ifWeightClass="A">
				<option weightClass="A,A,A">%COMPANY%</option>
				<option weightClass="A,A,H" weight="2">%COMPANY%</option>
				<option weightClass="A,H,H" weight="3">%COMPANY%</option>
			</subforceOption>
			<subforceOption ifWeightClass="H">
				<option weightClass="A,H,H">%COMPANY%</option>
				<option weightClass="H,H,H" weight="2">%COMPANY%</option>
				<option weightClass="H,H,M" weight="3">%COMPANY%</option>
			</subforceOption>
			<subforceOption ifWeightClass="M">
				<option weightClass="H,M,M">%COMPANY%</option>
				<option weightClass="M,M,M" weight="2">%COMPANY%</option>
				<option weightClass="M,M,L">%COMPANY%</option>
			</subforceOption>
			<subforceOption ifWeightClass="L">
				<option weightClass="M,M,L" weight="2">%COMPANY%</option>
				<option weightClass="M,L,L" weight="2">%COMPANY%</option>
				<option weightClass="L,L,L">%COMPANY%</option>
			</subforceOption>
		</subforces>
	</force>
	
	<!-- Giving each company a 50% chance of having a Mek regiment should give each corps
	1-2 battalions total. The first lance will be either Mek or armor, the second either
	armor or infantry, and the third will always be infantry. -->
	
	<force eschelon="%COMPANY%" eschName="Company" ifUnitType="">
		<name ifRole="command">Command Company</name>
		<name>{alpha} Company</name>
		<co>%CAPTAIN%</co>
		
		<weightClass>
			<option weight="1">A</option>
			<option weight="3">H</option>
			<option weight="5">M</option>
			<option weight="3">L</option>
		</weightClass>
		
		<subforces>
			<subforceOption ifWeightClass="A">
				<option weightClass="A" weight="2" unitType="Mek">%LANCE%</option>
				<option weightClass="H" weight="1" unitType="Mek">%LANCE%</option>
				<option weightClass="A" weight="2" unitType="Tank">%LANCE%</option>
				<option weightClass="H" weight="1" unitType="Tank">%LANCE%</option>
			</subforceOption>
			<subforceOption ifWeightClass="H">
				<option weightClass="H" weight="2" unitType="Mek">%LANCE%</option>
				<option weightClass="M" weight="1" unitType="Mek">%LANCE%</option>
				<option weightClass="H" weight="2" unitType="Tank">%LANCE%</option>
				<option weightClass="M" weight="1" unitType="Tank">%LANCE%</option>
			</subforceOption>
			<subforceOption ifWeightClass="M">
				<option weightClass="H" weight="1" unitType="Mek">%LANCE%</option>
				<option weightClass="M" weight="2" unitType="Mek">%LANCE%</option>
				<option weightClass="L" weight="1" unitType="Mek">%LANCE%</option>
				<option weightClass="H" weight="1" unitType="Tank">%LANCE%</option>
				<option weightClass="M" weight="2" unitType="Tank">%LANCE%</option>
				<option weightClass="L" weight="1" unitType="Tank">%LANCE%</option>
			</subforceOption>
			<subforceOption ifWeightClass="L">
				<option weightClass="M" weight="1" unitType="Mek">%LANCE%</option>
				<option weightClass="L" weight="2" unitType="Mek">%LANCE%</option>
				<option weightClass="M" weight="1" unitType="Tank">%LANCE%</option>
				<option weightClass="L" weight="2" unitType="Tank">%LANCE%</option>
			</subforceOption>
			
			<subforceOption ifWeightClass="A">
				<option weightClass="A" weight="2" unitType="Tank">%LANCE%</option>
				<option weightClass="H" weight="1" unitType="Tank">%LANCE%</option>
				<option weightClass="A" unitType="Infantry">%PLATOON%</option>
				<option weightClass="H" unitType="Infantry">%PLATOON%</option>
				<option weightClass="M" unitType="Infantry">%PLATOON%</option>
			</subforceOption>
			<subforceOption ifWeightClass="H">
				<option weightClass="H" weight="2" unitType="Tank">%LANCE%</option>
				<option weightClass="M" weight="1" unitType="Tank">%LANCE%</option>
				<option weightClass="H" unitType="Infantry">%PLATOON%</option>
				<option weightClass="M" weight="2" unitType="Infantry">%PLATOON%</option>
			</subforceOption>
			<subforceOption ifWeightClass="M">
				<option weightClass="H" weight="1" unitType="Tank">%LANCE%</option>
				<option weightClass="M" weight="2" unitType="Tank">%LANCE%</option>
				<option weightClass="L" weight="1" unitType="Tank">%LANCE%</option>
				<option weightClass="H" weight="1" unitType="Infantry">%LANCE%</option>
				<option weightClass="M" weight="2" unitType="Infantry">%LANCE%</option>
				<option weightClass="L" weight="1" unitType="Infantry">%LANCE%</option>
			</subforceOption>
			<subforceOption ifWeightClass="L">
				<option weightClass="M" weight="1" unitType="Tank">%LANCE%</option>
				<option weightClass="L" weight="2" unitType="Tank">%LANCE%</option>
				<option weightClass="M" weight="2" unitType="Infantry">%LANCE%</option>
				<option weightClass="L" weight="1" unitType="Infantry">%LANCE%</option>
			</subforceOption>			

			<subforceOption ifWeightClass="A">
				<option weightClass="A" unitType="Infantry">%PLATOON%</option>
				<option weightClass="H" unitType="Infantry">%PLATOON%</option>
				<option weightClass="M" unitType="Infantry">%PLATOON%</option>
			</subforceOption>
			<subforceOption ifWeightClass="H">
				<option weightClass="H" unitType="Infantry">%PLATOON%</option>
				<option weightClass="M" weight="2" unitType="Infantry">%PLATOON%</option>
			</subforceOption>
			<subforceOption ifWeightClass="M">
				<option weightClass="H" weight="1" unitType="Infantry">%LANCE%</option>
				<option weightClass="M" weight="2" unitType="Infantry">%LANCE%</option>
				<option weightClass="L" weight="1" unitType="Infantry">%LANCE%</option>
			</subforceOption>
			<subforceOption ifWeightClass="L">
				<option weightClass="M" weight="2" unitType="Infantry">%LANCE%</option>
				<option weightClass="L" weight="1" unitType="Infantry">%LANCE%</option>
			</subforceOption>			
		</subforces>		
	</force>
</ruleset>
