<?xml version="1.0" encoding="utf-8"?>

<ruleset faction="ROS" parent="IS" ratingSystem="ROS" xmlns:xsi="http://www.w3.org/2001/XMLSchema-instance" xsi:noNamespaceSchemaLocation="formationRulesetSchema.xsd">

	<defaults>
		<unitType>Mek</unitType>
		<eschelon>%REGIMENT%</eschelon>
		<rankSystem>%RANK_SL%</rankSystem>
		<rating>HS</rating>
	</defaults>
	
	<customRanks>
		<rank>%LT_COLONEL%:Lieutenant Colonel,Commodore,--MW,--MW,--MW,--MW</rank>
	</customRanks>

	<toc>
		<unitType>
			<option>Mek,Tank,VTOL,Infantry,BattleArmor,AeroSpaceFighter,Conventional Fighter</option>
		</unitType>
		
		<eschelon>
			<option ifUnitType="Mek|Tank|VTOL">%REGIMENT%,%BATTALION%,%COMPANY%,%LANCE%</option>
			<option ifUnitType="Infantry">%REGIMENT%,%BATTALION%,%COMPANY%</option>
			<option ifUnitType="BattleArmor">%BATTALION%,%COMPANY%,%PLATOON%</option>
			<option ifUnitType="AeroSpaceFighter|Conventional Fighter">%REGIMENT%,%WING%,%SQUADRON%,%FLIGHT%</option>
		</eschelon>
		
		<rating>
			<option>SB:Stone&apos;s Brigade,HS:Hastati Sentinels,PG:Principes Guards,TP:Triarii Protectors</option>
		</rating>
	</toc>

	<force eschelon="%REGIMENT%" eschName="Regiment" ifUnitType="Mek|Tank">
		<co ifUnitType="Tank">%LT_COLONEL%</co>
		<co>%COLONEL%</co>
		
		<changeEschelon ifRating="TP" ifUnitType="Mek">
			<option>%BATTALION%</option>
		</changeEschelon>
		
		<weightClass>
			<option weight="1">L</option>
			<option weight="2">M</option>
			<option weight="1">H</option>
		</weightClass>
		
		<subforces ifRating="!PG">
			<asParent/>
		</subforces>
		
		<subforces ifRating="PG">
			<subforceOption ifWeightClass="H|A">
				<option weightClass="A,A">%BATTALION%</option>
				<option weightClass="A,H">%BATTALION%</option>
				<option weightClass="A,M">%BATTALION%</option>
				<option weightClass="A,H">%BATTALION%</option>
				<option weightClass="H,H">%BATTALION%</option>
				<option weightClass="H,M">%BATTALION%</option>
			</subforceOption>
			<subforceOption ifWeightClass="M">
				<option weightClass="H,M">%BATTALION%</option>
				<option weightClass="M,M">%BATTALION%</option>
				<option weightClass="M,L">%BATTALION%</option>
			</subforceOption>
			<subforceOption ifWeightClass="L">
				<option weightClass="M,L">%BATTALION%</option>
				<option weightClass="L,L">%BATTALION%</option>
			</subforceOption>
		</subforces>
		
		<attachedForces ifUnitType="Mek" ifRating="!SB">
			<subforce unitType="Tank">%BRIGADE%</subforce>
			<subforce unitType="Infantry">%BRIGADE%</subforce>
			<subforce unitType="AeroSpaceFighter">%WING%</subforce>
		</attachedForces>
		
		<attachedForces ifUnitType="Mek" ifRating="SB">
			<subforce unitType="Tank">%REGIMENT%</subforce>
			<subforce unitType="BattleArmor">%BATTALION%</subforce>
			<subforce unitType="AeroSpaceFighter">%WING%</subforce>
		</attachedForces>
	</force>
	
	<force eschelon="%BRIGADE%" eschName="Brigade" ifUnitType="Tank" ifRating="TP">
		<co>%COLONEL%</co>
		
		<subforces>
			<subforce num="3">%REGIMENT%</subforce>
		</subforces>
		
		<attachedForces>
			<subforce role="artillery">%BATTALION%</subforce>
		</attachedForces>
	</force>
	
	<force eschelon="%BRIGADE%" eschName="Brigade" ifUnitType="Tank">
		<co>%COLONEL%</co>
		
		<subforces>
			<subforce num="2">%REGIMENT%</subforce>
		</subforces>
		
		<attachedForces>
			<subforce role="artillery">%COMPANY%</subforce>
		</attachedForces>
	</force>
	
	<force eschelon="%BRIGADE%" eschName="Brigade" ifUnitType="Infantry">
		<co>%COLONEL%</co>
		
		<subforces>
			<subforce num="3">%REGIMENT%</subforce>
		</subforces>
	</force>
	
	<force eschelon="%BATTALION%" eschName="Battalion" ifUnitType="Mek" ifRating="TP">
		<name>{ordinal} Battalion</name>
		<co>%COLONEL%</co>
		
		<weightClass>
			<option weight="4">A</option>
			<option weight="9">H</option>
			<option weight="9">M</option>
			<option weight="7">L</option>
		</weightClass>
		
		<subforces>
			<asParent/>
		</subforces>
		
		<attachedForces>
			<subforce unitType="Tank">%BRIGADE%</subforce>
			<subforce unitType="Infantry">%BRIGADE%</subforce>
			<subforce unitType="AeroSpaceFighter">%WING%</subforce>
		</attachedForces>
	</force>
</ruleset>
