<?xml version="1.0" encoding="utf-8"?>

<ruleset faction="CFM.MiKrKl" ratingSystem="CLAN" xmlns:xsi="http://www.w3.org/2001/XMLSchema-instance" xsi:noNamespaceSchemaLocation="formationRulesetSchema.xsd">

	<defaults>
		<eschelon>%CLUSTER%</eschelon>
		<rankSystem>%RANK_CUSTOM%</rankSystem>
		<rating>FL</rating>
	</defaults>
	
	<toc>
		<unitType>
			<option ifDateBetween="3060,">null,Mek,ProtoMek,Tank,VTOL,Infantry,BattleArmor,AeroSpaceFighter,Conventional Fighter</option>
			<option ifDateBetween="2870,3059">null,Mek,Tank,VTOL,Infantry,BattleArmor,AeroSpaceFighter,Conventional Fighter</option>
			<option ifDateBetween=",2869">null,Mek,Tank,VTOL,Infantry,AeroSpaceFighter,Conventional Fighter</option>
		</unitType>
		
		<eschelon>
			<option ifUnitType="">%GALAXY%,%CLUSTER%</option>
			<option ifUnitType="BattleArmor">%CLUSTER%,%TRINARY%^,%TRINARY%,%BINARY%^,%BINARY%,%STAR%^,%STAR%</option>
			<option ifUnitType="Mek|AeroSpaceFighter" ifDateBetween="2870,">%TRINARY%^,%TRINARY%,%BINARY%^,%BINARY%,%STAR%^,%STAR%</option>
			<option>%TRINARY%,%BINARY%,%STAR%</option>
		</eschelon>
		
		<rating>
			<option ifUnitType="Tank|VTOL">SL:Second Line,PG:Garrison,Sol:Solahma</option>
			<option ifUnitType="Infantry" ifDateBetween="2900,">PG:Garrison,Sol:Solahma</option>
			<option ifUnitType="Infantry">PG:Garrison,Sol:Solahma</option>
			<option ifEschelon="%GALAXY%"></option>
			<option>Keshik,FL:Front Line,SL:Second Line,PG:Garrison,Sol:Solahma</option>
		</rating>
		
		<flags>
			<option ifUnitType="null|Mek|BattleArmor" ifEschelon="%TRINARY%|%BINARY%">mixedMekBA:Combined Mek/BA unit</option>
			<option ifUnitType="null|Mek|AeroSpaceFighter" ifEschelon="%TRINARY%|%BINARY%">mixedMekAero:Combined Mek/Aero unit</option>
			<option ifUnitType="null|Mek|AeroSpaceFighter" ifEschelon="%STAR%|STAR^">mekAeroNova:Mek+Aero Nova</option>
		</flags>
	</toc>
	
	<force eschelon="%GALAXY%" eschName="Kindraa">
		<co>%GALAXY_CMDR%</co>
		
		<subforces>
			<subforce role="command" rating="Keshik"
				unitType="Mek" faction="CFM.Kl">%TRINARY%</subforce>
			<subforceOption>
				<option num="1" rating="FL"
					faction="CFM.MiKr">%CLUSTER%</option>
				<option num="2" rating="FL"
					faction="CFM.MiKr">%CLUSTER%</option>
			</subforceOption>
			<subforce num="1" rating="FL" faction="CFM.MiKr"
				unitType="AeroSpaceFighter">%CLUSTER%</subforce>
			<subforce num="1" rating="FL" faction="CFM.MiKr"
				unitType="BattleArmor">%CLUSTER%</subforce>
			<subforceOption>
				<option num="2" rating="SL"
					faction="CFM.Kl">%CLUSTER%</option>
				<option num="3" rating="SL"
					faction="CFM.Kl">%CLUSTER%</option>
			</subforceOption>
			<subforce rating="SL" faction="CFM.MiKr">%CLUSTER%</subforce>
		</subforces>

		<attachedForces>
			<subforce unitType="Warship" fluffName="CFM Jungle Fever"
				chassis="Potemkin Troop Cruiser"
				ifDateBetween=",3071">%ELEMENT%</subforce>
			<subforce unitType="Warship" fluffName="CFM Rancor"
				chassis="Lola III Destroyer"
				ifDateBetween=",3071">%ELEMENT%</subforce>
		</attachedForces>
	</force>
</ruleset>	

