<?xml version="1.0" encoding="utf-8"?>

<!-- MOC units are structured around a Mek regiment with an armor guard of 1-2
battalions and an infantry guard ranging from a battalion to a regiment. Air
support is very weak, with most of the ASFs attached to central command and assigned
as needed. Prior to the Trinity Alliance, only the Royal Guard had any permanent air
guard and that was typically limited to a single flight. After 3060 the Magistracy
made a concerted effort to expand aerospace forces, adding an air guard to Chasseurs Ã 
Cheval regiments as well and averaging just under a squadron by the Jihad, and
expanding to a full wing per regiment by the Dark Age. -->

<ruleset faction="MOC" parent="Periphery" ratingSystem="IS" xmlns:xsi="http://www.w3.org/2001/XMLSchema-instance" xsi:noNamespaceSchemaLocation="formationRulesetSchema.xsd">

	<defaults>
		<unitType ifFaction="MOC.RC" ifDateBetween=",3062">Infantry</unitType>
		<unitType>Mek</unitType>
		<eschelon>%REGIMENT%</eschelon>
		<rankSystem>%RANK_MOC%</rankSystem>
		<rating>C</rating>
	</defaults>

	<toc>
		<unitType>
			<option ifDateBetween="3051,">Mek,Tank,VTOL,Infantry,BattleArmor,AeroSpaceFighter,Conventional Fighter</option>
			<option>Mek,Tank,VTOL,Infantry,AeroSpaceFighter,Conventional Fighter</option>
		</unitType>
		
		<eschelon>
			<option ifUnitType="Mek|Tank|VTOL">%REGIMENT%,%BATTALION%,%COMPANY%,%LANCE%</option>
			<option ifUnitType="Infantry">%REGIMENT%,%BATTALION%,%COMPANY%</option>
			<option ifUnitType="BattleArmor">%BATTALION%,%COMPANY%,%PLATOON%</option>
			<option ifUnitType="AeroSpaceFighter|Conventional Fighter">%WING%,%SQUADRON%,%FLIGHT%</option>
		</eschelon>
		
		<rating>
			<option>A,B,C,D,F</option>
		</rating>
	</toc>
	
	<force eschelon="%REGIMENT%" eschName="Regiment" ifUnitType="Mek">
		<name ifFaction="MOC.MRG">{ordinal} Canopian Cuirassiers</name>
		<name ifFaction="MOC.CC">{ordinal} Canopian Light Horse</name>
		<name ifFaction="MOC.CF">{ordinal} Canopian Fusiliers</name>
		<name ifFaction="MOC.MH">{ordinal} Magistracy Highlanders</name>
		<name ifFaction="MOC.RC">{ordinal} Raventhir Cuirassiers</name>
		<co>%COLONEL%</co>
		
		<weightClass>
			<option weight="1">H</option>
			<option weight="3">M</option>
			<option weight="2">L</option>
		</weightClass>
		
		<subforces>
			<subforceOption ifWeightClass="A">
				<option weightClass="A,H,H">%BATTALION%</option>
				<option weightClass="A,H,M">%BATTALION%</option>
				<option weightClass="A,H,L">%BATTALION%</option>
				<option weightClass="A,M,M" weight="2">%BATTALION%</option>
				<option weightClass="A,M,L" weight="2">%BATTALION%</option>
			</subforceOption>
			<subforceOption ifWeightClass="H">
				<option weightClass="H,H,H">%BATTALION%</option>
				<option weightClass="H,H,M">%BATTALION%</option>
				<option weightClass="H,H,L" weight="2">%BATTALION%</option>
				<option weightClass="H,M,M" weight="3">%BATTALION%</option>
				<option weightClass="H,M,L" weight="2">%BATTALION%</option>
			</subforceOption>
			<subforceOption ifWeightClass="M">
				<option weightClass="H,M,M" weight="2">%BATTALION%</option>
				<option weightClass="H,M,L">%BATTALION%</option>
				<option weightClass="M,M,M" weight="3">%BATTALION%</option>
				<option weightClass="M,M,L" weight="2">%BATTALION%</option>
			</subforceOption>
			<subforceOption ifWeightClass="L">
				<option weightClass="H,L,L">%BATTALION%</option>
				<option weightClass="M,M,L" weight="2">%BATTALION%</option>
				<option weightClass="M,L,L" weight="3">%BATTALION%</option>
				<option weightClass="L,L,L">%BATTALION%</option>
			</subforceOption>
		</subforces>

		<attachedForces>
			<subforceOption ifFaction="MOC.MRG">
				<option unitType="AeroSpaceFighter" ifDateBetween=",3070"
					name="Air Guard">%FLIGHT%</option>
				<option unitType="AeroSpaceFighter" ifDateBetween="3056,3080"
					name="Air Guard">%SQUADRON%-</option>
				<option unitType="AeroSpaceFighter" ifDateBetween="3060,3090"
					name="Air Guard">%SQUADRON%</option>
				<option unitType="AeroSpaceFighter" ifDateBetween="3065,3110"
					name="Air Guard">%WING%-</option>
				<option unitType="AeroSpaceFighter" ifDateBetween="3080,"
					name="Air Guard">%WING%</option>
			</subforceOption>
			<subforceOption ifFaction="MOC.CC">
				<option ifDateBetween=",3070"/>
				<option unitType="AeroSpaceFighter" ifDateBetween="3060,3075"
					name="Air Guard">%FLIGHT%</option>
				<option unitType="AeroSpaceFighter" ifDateBetween="3066,3085"
					name="Air Guard">%SQUADRON%-</option>
				<option unitType="AeroSpaceFighter" ifDateBetween="3071,3100"
					name="Air Guard">%SQUADRON%</option>
				<option unitType="AeroSpaceFighter" ifDateBetween="3076,"
					name="Air Guard">%WING%-</option>
				<option unitType="AeroSpaceFighter" ifDateBetween="3080,"
					name="Air Guard">%WING%</option>
			</subforceOption>
			<subforceOption ifFaction="!MOC.MH">
				<option unitType="Tank"
					name="Armor Guard" weight="3">%REGIMENT%-</option>
				<option unitType="Tank"
					name="Armor Guard" weight="3">%BATTALION%</option>
				<option/>
			</subforceOption>
			<subforceOption>
				<option unitType="Infantry"
					name="Infantry Guard">%REGIMENT%</option>			
				<option unitType="Infantry" weight="11"
					name="Infantry Guard">%BATTALION%</option>			
			</subforceOption>
		</attachedForces>
	</force>
	
	<force eschelon="%REGIMENT%" eschName="Regiment" ifUnitType="Infantry">
		<name ifDateBetween=",3062" ifFaction="MOC.RC">{ordinal} Raventhir Footmen</name>
		<co>%COLONEL%</co>
		
		<weightClass>
			<option weight="1">A</option>
			<option weight="2">H</option>
			<option weight="4">M</option>
			<option weight="3">L</option>
		</weightClass>

		<subforces>
			<asParent/>
		</subforces>
	</force>
	
	<force eschelon="%COMPANY%" eschName="Company" ifUnitType="Infantry"
			ifRole="artillery|missile_artillery">
		<name>{ordinal} Field Artillery Company</name>
		<co>%CAPTAIN%</co>

		<subforces generate="group">
			<subforce num="3">%PLATOON%</subforce>
		</subforces>
	</force>
	
	<force eschelon="%COMPANY%" eschName="Company" ifUnitType="Infantry|BattleArmor">
		<name>{alpha} Company</name>
		<co>%CAPTAIN%</co>
		
		<unitType ifUnitType="Infantry" ifDateBetween="3051,"
				ifRole="">
			<option weight="1">BattleArmor</option>
			<option weight="11" ifDateBetween="3055,3060">Infantry</option>
			<option weight="9" ifDateBetween="3061,3075">Infantry</option>
			<option weight="7" ifDateBetween="3076,">Infantry</option>
		</unitType>
		
		<weightClass>
			<option weight="1">A</option>
			<option weight="2">H</option>
			<option weight="4">M</option>
			<option weight="3">L</option>
		</weightClass>
		
		<ruleGroup>
			<role ifUnitType="Infantry">
				<option weight="1">anti_mek</option>
				<option />
				<option ifWeightClass="H" weight="3" />
				<option ifWeightClass="M|L" weight="17" />
			</role>
			
			<variant ifWeightClass="H|A" ifUnitType="Infantry">
				<option weight="1">(Laser),(SRM)</option>
				<option />
			</variant>

			<motive ifUnitType="Infantry">
				<option weight="1" ifWeightClass="1">Jump</option>
				<option weight="2">Hover</option>
				<option weight="1">Wheeled</option>
				<option weight="3">Motorized</option>
				<option weight="12">Leg</option>
				<option weight="12" ifWeightClass="H|A">Leg</option>
				<option weight="9"/>
			</motive>
		</ruleGroup>

		<subforces ifUnitType="Infantry" generate="group">
			<subforce num="3">%PLATOON%</subforce>
		</subforces>

		<subforces ifUnitType="BattleArmor">
			<subforce num="4">%PLATOON%</subforce>
		</subforces>
	</force>

	<force eschelon="%FLIGHT%" eschName="Air Lance" ifUnitType="AeroSpaceFighter|Conventional Fighter">
		<co>%LT%</co>
		
		<weightClass>
			<option>H</option>
			<option>M</option>
			<option>L</option>
		</weightClass>

		<ruleGroup>
			<formation>
				<option weight="3" ifWeightClass="L|M">Aerospace Superiority Squadron</option>
				<option>Fire Support Squadron</option>
				<option weight="2" ifWeightClass="L|M">Interceptor Squadron</option>
				<option weight="3" ifWeightClass="M|H">Strike Squadron</option>
			</formation>
		</ruleGroup>

		<subforces generate="group">
			<subforce num="2">%ELEMENT%</subforce>
		</subforces>
	</force>
</ruleset>
