<?xml version="1.0" encoding="utf-8"?>

<!-- The Castillian military is modeled closely on the Umayyad Caliphate, which combines
Meks, armor, and infantry in all units above lance size. Forces are combined into brigadas
of six regiments each. No mention is made of aerospace units, but one or two wings per
brigada seems reasonable. -->

<ruleset faction="NC" parent="UC" ratingSystem="IS" xmlns:xsi="http://www.w3.org/2001/XMLSchema-instance" xsi:noNamespaceSchemaLocation="formationRulesetSchema.xsd">

	<defaults>
		<eschelon>%BRIGADE%</eschelon>
		<rankSystem>%RANK_CUSTOM%</rankSystem>
		<rating>C</rating>
	</defaults>
	
	<customRanks>
		<rank>%E1%:Caballero</rank>
		<rank>%LT%:Captain</rank>
		<rank>%CAPTAIN%:Major</rank>
		<rank>%MAJOR%:Comandante</rank>
		<rank>%COLONEL%:Principe</rank>
	</customRanks>

	<toc>
		<unitType>
			<option>null,Mek,Tank,VTOL,Infantry,AeroSpaceFighter,Conventional Fighter</option>
		</unitType>
		
		<eschelon>
			<option ifUnitType="">%BRIGADE%,%REGIMENT%,%BATTALION%,%COMPANY%</option>
			<option ifUnitType="Mek|Tank|VTOL">%LANCE%</option>
			<option ifUnitType="Infantry">%PLATOON%</option>
			<option ifUnitType="AeroSpaceFighter|Conventional Fighter">%WING%,%SQUADRON%,%FLIGHT%</option>
		</eschelon>
		
		<rating>
			<option>A,B,C,D,F</option>
		</rating>
	</toc>
	
	<force eschelon="%BRIGADE%" eschName="Brigada">
		<co>%COLONEL%</co>
		
		<subforces>
			<subforce num="6">%REGIMENT%</subforce>
		</subforces>
		
		<attachedForces>
			<subforce num="2" unitType="AeroSpaceFighter">%WING%</subforce>
		</attachedForces>
	</force>

	<!-- FM:Update gives the total Mek strength at about two regiments, which gives about
	works out to about one Mek lance for every four companies. -->
	
	<force eschelon="%COMPANY%" eschName="Company" ifUnitType="">
		<name ifRole="command">Command Company</name>
		<name>{formation} Company</name>
		<co>%CAPTAIN%</co>
		
		<weightClass>
			<option weight="1">A</option>
			<option weight="3">H</option>
			<option weight="5">M</option>
			<option weight="3">L</option>
		</weightClass>
		
		<subforces>
			<subforceOption ifWeightClass="A">
				<option weightClass="A" weight="2" unitType="Mek">%LANCE%</option>
				<option weightClass="H" weight="1" unitType="Mek">%LANCE%</option>
				<option weightClass="A" weight="6" unitType="Tank">%LANCE%</option>
				<option weightClass="H" weight="3" unitType="Tank">%LANCE%</option>
			</subforceOption>
			<subforceOption ifWeightClass="H">
				<option weightClass="H" weight="2" unitType="Mek">%LANCE%</option>
				<option weightClass="M" weight="1" unitType="Mek">%LANCE%</option>
				<option weightClass="H" weight="6" unitType="Tank">%LANCE%</option>
				<option weightClass="M" weight="3" unitType="Tank">%LANCE%</option>
			</subforceOption>
			<subforceOption ifWeightClass="M">
				<option weightClass="H" weight="1" unitType="Mek">%LANCE%</option>
				<option weightClass="M" weight="2" unitType="Mek">%LANCE%</option>
				<option weightClass="L" weight="1" unitType="Mek">%LANCE%</option>
				<option weightClass="H" weight="3" unitType="Tank">%LANCE%</option>
				<option weightClass="M" weight="6" unitType="Tank">%LANCE%</option>
				<option weightClass="L" weight="3" unitType="Tank">%LANCE%</option>
			</subforceOption>
			<subforceOption ifWeightClass="L">
				<option weightClass="M" weight="1" unitType="Mek">%LANCE%</option>
				<option weightClass="L" weight="2" unitType="Mek">%LANCE%</option>
				<option weightClass="M" weight="3" unitType="Tank">%LANCE%</option>
				<option weightClass="L" weight="6" unitType="Tank">%LANCE%</option>
			</subforceOption>
			
			<subforceOption ifWeightClass="A">
				<option weightClass="A" weight="2" unitType="Tank">%LANCE%</option>
				<option weightClass="H" weight="1" unitType="Tank">%LANCE%</option>
				<option weightClass="A" unitType="Infantry">%PLATOON%</option>
				<option weightClass="H" unitType="Infantry">%PLATOON%</option>
				<option weightClass="M" unitType="Infantry">%PLATOON%</option>
			</subforceOption>
			<subforceOption ifWeightClass="H">
				<option weightClass="H" weight="2" unitType="Tank">%LANCE%</option>
				<option weightClass="M" weight="1" unitType="Tank">%LANCE%</option>
				<option weightClass="H" unitType="Infantry">%PLATOON%</option>
				<option weightClass="M" weight="2" unitType="Infantry">%PLATOON%</option>
			</subforceOption>
			<subforceOption ifWeightClass="M">
				<option weightClass="H" weight="1" unitType="Tank">%LANCE%</option>
				<option weightClass="M" weight="2" unitType="Tank">%LANCE%</option>
				<option weightClass="L" weight="1" unitType="Tank">%LANCE%</option>
				<option weightClass="H" weight="1" unitType="Infantry">%LANCE%</option>
				<option weightClass="M" weight="2" unitType="Infantry">%LANCE%</option>
				<option weightClass="L" weight="1" unitType="Infantry">%LANCE%</option>
			</subforceOption>
			<subforceOption ifWeightClass="L">
				<option weightClass="M" weight="1" unitType="Tank">%LANCE%</option>
				<option weightClass="L" weight="2" unitType="Tank">%LANCE%</option>
				<option weightClass="M" weight="2" unitType="Infantry">%LANCE%</option>
				<option weightClass="L" weight="1" unitType="Infantry">%LANCE%</option>
			</subforceOption>			

			<subforceOption ifWeightClass="A">
				<option weightClass="A" unitType="Infantry">%PLATOON%</option>
				<option weightClass="H" unitType="Infantry">%PLATOON%</option>
				<option weightClass="M" unitType="Infantry">%PLATOON%</option>
			</subforceOption>
			<subforceOption ifWeightClass="H">
				<option weightClass="H" unitType="Infantry">%PLATOON%</option>
				<option weightClass="M" weight="2" unitType="Infantry">%PLATOON%</option>
			</subforceOption>
			<subforceOption ifWeightClass="M">
				<option weightClass="H" weight="1" unitType="Infantry">%LANCE%</option>
				<option weightClass="M" weight="2" unitType="Infantry">%LANCE%</option>
				<option weightClass="L" weight="1" unitType="Infantry">%LANCE%</option>
			</subforceOption>
			<subforceOption ifWeightClass="L">
				<option weightClass="M" weight="2" unitType="Infantry">%LANCE%</option>
				<option weightClass="L" weight="1" unitType="Infantry">%LANCE%</option>
			</subforceOption>			
		</subforces>		
	</force>
</ruleset>
